{
  "$schema": "../../schemas/v1.7-form-factor-profiles.schema.json",
  "schemaVersion": 1,
  "contractId": "goreecloud.glaze-ui.v1.7.form-factor-profiles",
  "name": "Glaze UI V1.7 First-Class Form-Factor Profiles Development Contract",
  "version": "1.7.0-dev.3",
  "lifecycle": "Development",
  "stableBaseline": "1.6.0",
  "consumerEligible": false,
  "implementedSpecificationSections": [3],
  "profiles": ["mobile","tablet","desktop","foldable","tv","wearable"],
  "priorityProfiles": ["mobile","tablet"],
  "profileAuthorityInputs": [
    "application-window",
    "viewing-distance",
    "primary-input",
    "posture",
    "platform-conventions",
    "application-task",
    "accessibility",
    "safe-area"
  ],
  "profileDimensions": [
    "navigation",
    "reachability",
    "density",
    "safe-areas",
    "viewing-distance",
    "primary-input",
    "typography",
    "action-placement",
    "information-hierarchy",
    "pane-behavior",
    "overlay-behavior",
    "motion",
    "interaction-targets"
  ],
  "profileDefinitions": {
    "mobile": {
      "priority": "first",
      "navigation": "bottom-or-compact",
      "reachability": "reachable-primary-zone",
      "density": "comfortable",
      "safeAreas": "platform-insets",
      "viewingDistance": "near",
      "primaryInputs": ["touch","keyboard","voice-access","switch-access","assistive-input"],
      "typography": "compact-near-view",
      "actionPlacement": "thumb-reachable-primary",
      "informationHierarchy": "single-primary-task",
      "paneBehavior": "single-pane",
      "overlayBehavior": "sheet-or-full-screen",
      "motion": "bounded-near-view",
      "interactionTargets": "touch-floor"
    },
    "tablet": {
      "priority": "first",
      "navigation": "rail-or-compact-sidebar",
      "reachability": "touch-and-pointer-aware",
      "density": "standard",
      "safeAreas": "platform-insets",
      "viewingDistance": "near",
      "primaryInputs": ["touch","pointer","keyboard","stylus","voice-access","switch-access","assistive-input"],
      "typography": "medium-near-view",
      "actionPlacement": "reachable-primary-and-contextual",
      "informationHierarchy": "primary-plus-supporting",
      "paneBehavior": "dual-pane",
      "overlayBehavior": "sheet-or-side-pane",
      "motion": "bounded-near-view",
      "interactionTargets": "touch-floor"
    },
    "desktop": {
      "priority": "standard",
      "navigation": "sidebar-rail-or-toolbar",
      "reachability": "pointer-keyboard-first-with-touch-support",
      "density": "standard",
      "safeAreas": "window-and-platform-insets",
      "viewingDistance": "near",
      "primaryInputs": ["pointer","keyboard","touch","stylus","voice-access","switch-access","assistive-input"],
      "typography": "workspace-near-view",
      "actionPlacement": "stable-toolbar-and-contextual",
      "informationHierarchy": "multi-region",
      "paneBehavior": "multi-pane",
      "overlayBehavior": "popover-dialog-or-floating-panel",
      "motion": "bounded-workspace",
      "interactionTargets": "mixed-input-floor"
    },
    "foldable": {
      "priority": "standard",
      "navigation": "posture-aware",
      "reachability": "posture-aware",
      "density": "standard",
      "safeAreas": "platform-insets-and-unsafe-regions",
      "viewingDistance": "near",
      "primaryInputs": ["touch","pointer","keyboard","stylus","voice-access","switch-access","assistive-input"],
      "typography": "posture-aware-near-view",
      "actionPlacement": "avoid-unsafe-regions",
      "informationHierarchy": "posture-dependent",
      "paneBehavior": "single-or-dual-by-posture",
      "overlayBehavior": "sheet-side-pane-or-full-screen",
      "motion": "posture-continuous",
      "interactionTargets": "touch-floor"
    },
    "tv": {
      "priority": "standard",
      "navigation": "directional-focus",
      "reachability": "far-view-directional",
      "density": "comfortable",
      "safeAreas": "platform-safe-region",
      "viewingDistance": "far",
      "primaryInputs": ["remote-dpad","keyboard","voice-access","switch-access","assistive-input"],
      "typography": "far-view",
      "actionPlacement": "focus-order-visible",
      "informationHierarchy": "large-structured-regions",
      "paneBehavior": "task-dependent-large-regions",
      "overlayBehavior": "far-view-panel-or-dialog",
      "motion": "bounded-far-view-focus",
      "interactionTargets": "far-view-floor"
    },
    "wearable": {
      "priority": "standard",
      "navigation": "shallow-and-glanceable",
      "reachability": "single-focus",
      "density": "comfortable",
      "safeAreas": "platform-insets",
      "viewingDistance": "near-glance",
      "primaryInputs": ["touch","rotary","voice-access","switch-access","assistive-input"],
      "typography": "glanceable",
      "actionPlacement": "single-primary-action",
      "informationHierarchy": "primary-value-first",
      "paneBehavior": "single-pane",
      "overlayBehavior": "full-screen-or-platform-native",
      "motion": "minimal-glanceable",
      "interactionTargets": "wearable-platform-floor"
    }
  },
  "adaptation": {
    "widthAloneIsProfileAuthority": false,
    "deviceBrandBreakpointAuthority": false,
    "semanticMeaningPreservedAcrossProfileChange": true,
    "taskContinuityRequired": true,
    "accessibilityMayOverrideDensity": true,
    "accessibilityMayReducePaneCount": true,
    "targetSizeMayShrinkToPreservePaneCount": false,
    "safeAreasOwnedByPlatform": true,
    "hardCodedCutoutInsetsAllowed": false
  },
  "wearableBoundary": {
    "governedProfileDefined": true,
    "nativeDeviceAcceptanceImplied": false,
    "productionSupportImplied": false
  },
  "experimentalProfiles": {
    "spatial": {
      "status": "experimental",
      "firstClassConsumerEligible": false,
      "requiresSeparateNativePlatformEvidence": true,
      "requiresSeparateAccessibilityEvidence": true,
      "requiresSeparateInteractionEvidence": true,
      "requiresSeparatePerformanceEvidence": true,
      "requiresSeparateRepresentativeDeviceEvidence": true
    }
  },
  "authority": {
    "boundary": "presentation-only",
    "profileSelectedByCallerOrPlatform": true,
    "inputCapabilityCreatedByGlaze": false,
    "hardwareCapabilityCreatedByGlaze": false,
    "safeAreaCreatedByGlaze": false,
    "authorizationGrantedByGlaze": false,
    "permissionGrantedByGlaze": false,
    "consumerSupportCreatedByGlaze": false,
    "consequentialExecutionAutomatic": false
  },
  "runtimeEntrypoint": "js/glaze-v1.7-form-factor-profiles.dev.mjs",
  "developmentAggregateEntrypoint": "js/glaze-v1.7-development.mjs",
  "tokenMap": "tokens/glaze-v1.7-form-factor-profiles.dev.json",
  "boundary": "Development foundation only. GLAZE UI V1.6 / 1.6.0 remains current Official Stable. Form-factor profile resolution does not establish downstream, native-device, consumer, release, deployment, or production acceptance."
}